Issue Id,Parent Id,Issue Type,Summary,Description,Epic Link,Labels,Priority
S29-T1,S29,Sub-task,Load sample migration data to DEV and TEST,,,"Migration,Phase6",Medium
S29-T2,S29,Sub-task,Validate field mappings and relationships,,,"Migration,Phase6",Medium
S29-T3,S29,Sub-task,"Validate converted users, owners, and teams",,,"Migration,Phase6",Medium
S29-T4,S29,Sub-task,Validate data volumes and performance,,,"Migration,Phase6",Medium
S29-T5,S29,Sub-task,Run business validation workshops on migrated data,,,"Migration,Phase6",Medium
S29-T6,S29,Sub-task,Fix mapping issues and repeat as needed,,,"Migration,Phase6",Medium
S30,,Story,Final migration preparation and production load,"As a cutover team, we want final migration scripts and production load procedures ready so go-live is controlled.",REPLACE_WITH_EPIC_KEY,"Migration,Cutover,Phase6",High
S30-T1,S30,Sub-task,Finalize production migration runbook,,,"Migration,Cutover,Phase6",Medium
S30-T2,S30,Sub-task,Finalize cutover extracts and transformation scripts,,,"Migration,Cutover,Phase6",Medium
S30-T3,S30,Sub-task,Freeze source data rules for cutover window,,,"Migration,Cutover,Phase6",Medium
S30-T4,S30,Sub-task,Prepare rollback and contingency plan,,,"Migration,Cutover,Phase6",Medium
S30-T5,S30,Sub-task,Load production data during cutover,,,"Migration,Cutover,Phase6",Medium
S30-T6,S30,Sub-task,Execute post-load validation and sign-off,,,"Migration,Cutover,Phase6",Medium
S31,,Story,System integration testing and user acceptance testing,"As a business owner, I want the solution fully tested so the new CRM is ready for production use.",REPLACE_WITH_EPIC_KEY,"Testing,Phase7",High
S31-T1,S31,Sub-task,Create SIT test scripts by process area,,,"Testing,Phase7",Medium
S31-T2,S31,Sub-task,"Execute SIT across CRM, Data Warehouse, Dotdigital, and Finance and Operations touchpoints",,,"Testing,Phase7",Medium
S31-T3,S31,Sub-task,Create UAT scripts and expected outcomes,,,"Testing,Phase7",Medium
S31-T4,S31,Sub-task,Run UAT with business users,,,"Testing,Phase7",Medium
S31-T5,S31,Sub-task,Log and triage defects,,,"Testing,Phase7",Medium
S31-T6,S31,Sub-task,Retest fixes and obtain sign-off,,,"Testing,Phase7",Medium
S32,,Story,"Security, performance, and regression validation","As a platform owner, I want non-functional validation completed so the system is secure and reliable.",REPLACE_WITH_EPIC_KEY,"Testing,Security,Phase7",High
S32-T1,S32,Sub-task,Execute security role and hierarchy access testing,,,"Testing,Security,Phase7",Medium
S32-T2,S32,Sub-task,Validate field-level and record-level permissions,,,"Testing,Security,Phase7",Medium
S32-T3,S32,Sub-task,"Execute performance tests for forms, views, dashboards, and integrations",,,"Testing,Security,Phase7",Medium
S32-T4,S32,Sub-task,Execute regression test pack after major releases,,,"Testing,Security,Phase7",Medium
S32-T5,S32,Sub-task,Validate audit logging and monitoring coverage,,,"Testing,Security,Phase7",Medium
S32-T6,S32,Sub-task,Sign off on non-functional readiness,,,"Testing,Security,Phase7",Medium
S33,,Story,Training and change management,"As an end user, I want training and support materials so I can adopt the new CRM confidently.",REPLACE_WITH_EPIC_KEY,"Training,ChangeManagement,Phase7",Medium
S33-T1,S33,Sub-task,Create role-based training plan,,,"Training,ChangeManagement,Phase7",Medium
S33-T2,S33,Sub-task,Create training guides and quick reference sheets,,,"Training,ChangeManagement,Phase7",Medium
S33-T3,S33,Sub-task,Create admin support guide,,,"Training,ChangeManagement,Phase7",Medium
S33-T4,S33,Sub-task,Train super users and champions,,,"Training,ChangeManagement,Phase7",Medium
S33-T5,S33,Sub-task,Run end-user training sessions,,,"Training,ChangeManagement,Phase7",Medium
S33-T6,S33,Sub-task,Capture feedback and refine materials,,,"Training,ChangeManagement,Phase7",Medium
S34,,Story,Cutover planning and go-live readiness,"As a project team, we want a complete cutover plan so go-live happens in a controlled manner.",REPLACE_WITH_EPIC_KEY,"Cutover,Phase7",High
S34-T1,S34,Sub-task,Create detailed cutover checklist,,,"Cutover,Phase7",Medium
S34-T2,S34,Sub-task,Define go and no-go criteria,,,"Cutover,Phase7",Medium
S34-T3,S34,Sub-task,Define freeze window and communications,,,"Cutover,Phase7",Medium
S34-T4,S34,Sub-task,Confirm production support coverage and escalation matrix,,,"Cutover,Phase7",Medium
S34-T5,S34,Sub-task,Confirm final deployment package and migration readiness,,,"Cutover,Phase7",Medium
S34-T6,S34,Sub-task,Hold cutover rehearsal and readiness review,,,"Cutover,Phase7",Medium
S35,,Story,Production deployment and go-live,"As a project sponsor, I want the new CRM deployed successfully so the business can transition to the new platform.",REPLACE_WITH_EPIC_KEY,"Cutover,GoLive,Phase8",High
S35-T1,S35,Sub-task,Deploy production solution components,,,"Cutover,GoLive,Phase8",Medium
S35-T2,S35,Sub-task,Execute production data migration,,,"Cutover,GoLive,Phase8",Medium
S35-T3,S35,Sub-task,Enable integrations and scheduled jobs,,,"Cutover,GoLive,Phase8",Medium
S35-T4,S35,Sub-task,Execute smoke testing,,,"Cutover,GoLive,Phase8",Medium
S35-T5,S35,Sub-task,"Validate critical reports, dashboards, and record access",,,"Cutover,GoLive,Phase8",Medium
S35-T6,S35,Sub-task,Obtain go-live approval and announce launch,,,"Cutover,GoLive,Phase8",Medium
S36,,Story,Hypercare and support transition,"As a support organization, we want hypercare completed and ownership transitioned so the system remains stable after launch.",REPLACE_WITH_EPIC_KEY,"Hypercare,Support,Phase8",Medium
S36-T1,S36,Sub-task,Stand up hypercare team and support channel,,,"Hypercare,Support,Phase8",Medium
S36-T2,S36,Sub-task,Monitor production issues and prioritize fixes,,,"Hypercare,Support,Phase8",Medium
S36-T3,S36,Sub-task,Reconcile integration and data issues daily,,,"Hypercare,Support,Phase8",Medium
S36-T4,S36,Sub-task,Track adoption metrics and user feedback,,,"Hypercare,Support,Phase8",Medium
S36-T5,S36,Sub-task,Transition support to steady-state operations,,,"Hypercare,Support,Phase8",Medium
S36-T6,S36,Sub-task,Conduct lessons learned and closeout review,,,"Hypercare,Support,Phase8",Medium
